{
  "definitions": {},
  "$schema": "http://json-schema.org/draft-07/schema#",
  "$id": "http://example.com/root.json",
  "type": "array",
  "title": "The Root Schema",
  "items": {
    "$id": "#/items",
    "type": "object",
    "title": "The Items Schema",
    "required": [
      "conditionId",
      "personId",
      "visitId",
      "conceptName",
      "additionalStandardConceptNames",
      "startDate",
      "startDatePrecision",
      "endDate",
      "endDatePrecision",
      "typeConceptName",
      "sourceConceptName"
    ],
    "properties": {
      "conditionId": {
        "$id": "#/items/properties/conditionId",
        "type": "string",
        "title": "The Conditionid Schema",
        "default": "",
        "examples": [
          "7df9675e-d490-4cf8-835d-e891cddeaaf5"
        ],
        "pattern": "^(.*)$"
      },
      "personId": {
        "$id": "#/items/properties/personId",
        "type": "string",
        "title": "The Personid Schema",
        "default": "",
        "examples": [
          "81163710-c2a2-4750-8e7f-8c7e18575695"
        ],
        "pattern": "^(.*)$"
      },
      "visitId": {
        "$id": "#/items/properties/visitId",
        "type": "string",
        "title": "The Visitid Schema",
        "default": "",
        "examples": [
          "9dd3d353-ae7d-4008-975c-c0bab77c36fe"
        ],
        "pattern": "^(.*)$"
      },
      "conceptName": {
        "$id": "#/items/properties/conceptName",
        "type": "string",
        "title": "The Conceptname Schema",
        "default": "",
        "examples": [
          "Malignant melanoma of skin of face"
        ],
        "pattern": "^(.*)$"
      },
      "additionalStandardConceptNames": {
        "$id": "#/items/properties/additionalStandardConceptNames",
        "type": "string",
        "title": "The Additionalstandardconceptnames Schema",
        "default": "",
        "examples": [
          ""
        ],
        "pattern": "^(.*)$"
      },
      "startDate": {
        "$id": "#/items/properties/startDate",
        "type": "string",
        "title": "The Startdate Schema",
        "default": "",
        "examples": [
          ""
        ],
        "pattern": "^(.*)$"
      },
      "startDatePrecision": {
        "$id": "#/items/properties/startDatePrecision",
        "type": "string",
        "title": "The Startdateprecision Schema",
        "default": "",
        "examples": [
          ""
        ],
        "pattern": "^(.*)$"
      },
      "endDate": {
        "$id": "#/items/properties/endDate",
        "type": "string",
        "title": "The Enddate Schema",
        "default": "",
        "examples": [
          ""
        ],
        "pattern": "^(.*)$"
      },
      "endDatePrecision": {
        "$id": "#/items/properties/endDatePrecision",
        "type": "string",
        "title": "The Enddateprecision Schema",
        "default": "",
        "examples": [
          ""
        ],
        "pattern": "^(.*)$"
      },
      "typeConceptName": {
        "$id": "#/items/properties/typeConceptName",
        "type": "string",
        "title": "The Typeconceptname Schema",
        "default": "",
        "examples": [
          "Primary Condition"
        ],
        "pattern": "^(.*)$"
      },
      "sourceConceptName": {
        "$id": "#/items/properties/sourceConceptName",
        "type": "string",
        "title": "The Sourceconceptname Schema",
        "default": "",
        "examples": [
          "Malignant melanoma of skin of other and unspecified parts of face"
        ],
        "pattern": "^(.*)$"
      }
    }
  }
}